{
  "actor": "method-review",
  "cost_note": "Revue réellement effectuée par le sous-agent indépendant /root/method_review ; facturation et tokens indisponibles.",
  "cost_source": "unknown",
  "created_at": "2026-09-14T12:15:49+00:00",
  "currency": "EUR",
  "human_rate_minor": 0,
  "human_seconds": 0,
  "id": "R-13cd2c02ce6d",
  "infra_cost_minor": 0,
  "input_tokens": null,
  "llm_cost_minor": null,
  "model": "Codex — identifiant exact non mesuré",
  "next_step": "Synchroniser les sources et preuves dans le dépôt principal, puis laisser la livraison soumise pour acceptation métier.",
  "outcome": "succeeded",
  "output_tokens": null,
  "purpose": "review",
  "stage": "review",
  "summary": "Revue indépendante : cinq critères examinés et satisfaits. Deux défauts identifiés puis corrigés et réexaminés. Preuve E-7543b32c1a5f relue et fraîcheur vérifiée ; aucun blocage restant. Suggestion mineure : réduire la répétition des consignes communes entre procédures.",
  "task": "T-6281659aad20"
}
