{
  "actor": "architecture-review",
  "cost_note": "Revue réelle du sous-agent indépendant /root/method_review ; coût et tokens non mesurés.",
  "cost_source": "unknown",
  "created_at": "2026-09-14T12:31:57+00:00",
  "currency": "EUR",
  "human_rate_minor": 0,
  "human_seconds": 0,
  "id": "R-97dbd5b9af33",
  "infra_cost_minor": 0,
  "input_tokens": null,
  "llm_cost_minor": null,
  "model": "Codex — identifiant exact non mesuré",
  "next_step": "Transférer les changements vers le dépôt principal et laisser la livraison soumise pour acceptation métier.",
  "outcome": "succeeded",
  "output_tokens": null,
  "purpose": "review",
  "stage": "review",
  "summary": "Quatre critères examinés et satisfaits. Catalogue MIT, choix explicites, invalidation et documentation validés. Doublon de découverte des tests et compatibilité des anciens paquets corrigés. Preuve finale E-9f6a10b6eb2c courante ; aucun défaut restant identifié.",
  "task": "T-6b0a3a1d068b"
}
