{
  "actor": "codex-coordination",
  "cost_note": "Coût et tokens de session indisponibles ; tests hors ligne sans appel fournisseur.",
  "cost_source": "unknown",
  "created_at": "2026-09-14T08:26:36+00:00",
  "currency": "EUR",
  "human_rate_minor": 0,
  "human_seconds": 0,
  "id": "R-5654e94313b3",
  "infra_cost_minor": 0,
  "input_tokens": null,
  "llm_cost_minor": null,
  "model": "Codex — identifiant exact non mesuré",
  "next_step": "Valider les scénarios corrigés, les adaptateurs et la documentation puis soumettre à une revue indépendante.",
  "outcome": "failed",
  "output_tokens": null,
  "purpose": "implementation",
  "summary": "Implémentation des interfaces, points de contrôle et coûts de livraison ; première suite échouée sur un commit vide dans une fixture, corrigé. Aucun montant inventé.",
  "task": "T-b6e566ad5966"
}
