{
  "actor": "codex-architecture-profiles",
  "cost_note": "Facturation et tokens indisponibles. Catalogue et choix testés localement ; aucun SaaS installé, aucun appel fournisseur par le framework.",
  "cost_source": "unknown",
  "created_at": "2026-09-14T12:31:11+00:00",
  "currency": "EUR",
  "human_rate_minor": 0,
  "human_seconds": 0,
  "id": "R-9a7912c7085d",
  "infra_cost_minor": 0,
  "input_tokens": null,
  "llm_cost_minor": null,
  "model": "Codex — identifiant exact non mesuré",
  "next_step": "Enregistrer la revue indépendante finale puis synchroniser le dépôt principal et sa carte.",
  "outcome": "succeeded",
  "output_tokens": null,
  "purpose": "implementation",
  "stage": "execute",
  "summary": "Choix de bases SaaS publiques MIT, architecture personnalisée ou existante ajouté au skill et à la CLI. Révision et contraintes liées au cadrage ; compatibilité des anciens contextes préservée. 95 tests et 94 adaptateurs passent, paquet et notice vérifiés.",
  "task": "T-6b0a3a1d068b"
}
